{
  "$defs": {
    "iso_dt": {
      "pattern": "^\\d{4}-\\d{2}-\\d{2}T\\d{2}:\\d{2}:\\d{2}Z$",
      "type": "string"
    },
    "path": {
      "minLength": 1,
      "type": "string"
    },
    "run_id": {
      "pattern": "^[a-z0-9][a-z0-9\\-]{6,64}$",
      "type": "string"
    },
    "sha256": {
      "pattern": "^[a-f0-9]{64}$",
      "type": "string"
    }
  },
  "$schema": "https://json-schema.org/draft/2020-12/schema",
  "additionalProperties": false,
  "description": "Binds a run to its inputs, artifacts, reports, lineage, and exports by content hash.",
  "properties": {
    "artifacts": {
      "additionalProperties": false,
      "properties": {
        "control_files": {
          "items": {
            "additionalProperties": false,
            "properties": {
              "bytes": {
                "minimum": 0,
                "type": "integer"
              },
              "path": {
                "$ref": "#/$defs/path"
              },
              "sha256": {
                "$ref": "#/$defs/sha256"
              }
            },
            "required": [
              "path",
              "sha256",
              "bytes"
            ],
            "type": "object"
          },
          "type": "array"
        },
        "files": {
          "items": {
            "additionalProperties": false,
            "properties": {
              "bytes": {
                "minimum": 0,
                "type": "integer"
              },
              "path": {
                "$ref": "#/$defs/path"
              },
              "sha256": {
                "$ref": "#/$defs/sha256"
              }
            },
            "required": [
              "path",
              "sha256",
              "bytes"
            ],
            "type": "object"
          },
          "type": "array"
        },
        "root_dir": {
          "type": "string"
        },
        "root_hash": {
          "$ref": "#/$defs/sha256"
        }
      },
      "required": [
        "root_hash",
        "files",
        "control_files"
      ],
      "type": "object"
    },
    "config": {
      "additionalProperties": true,
      "properties": {
        "config_path": {
          "type": "string"
        },
        "fingerprint": {
          "$ref": "#/$defs/sha256"
        }
      },
      "required": [
        "fingerprint"
      ],
      "type": "object"
    },
    "created_at": {
      "$ref": "#/$defs/iso_dt"
    },
    "exports": {
      "additionalProperties": false,
      "properties": {
        "briefing_tables": {
          "items": {
            "$ref": "#/$defs/path"
          },
          "type": "array"
        },
        "narratives": {
          "items": {
            "$ref": "#/$defs/path"
          },
          "type": "array"
        },
        "packets": {
          "items": {
            "$ref": "#/$defs/path"
          },
          "type": "array"
        }
      },
      "required": [
        "briefing_tables",
        "packets",
        "narratives"
      ],
      "type": "object"
    },
    "inputs": {
      "items": {
        "additionalProperties": false,
        "properties": {
          "fingerprint": {
            "$ref": "#/$defs/sha256"
          },
          "name": {
            "type": "string"
          },
          "row_count": {
            "minimum": 0,
            "type": "integer"
          }
        },
        "required": [
          "name",
          "fingerprint"
        ],
        "type": "object"
      },
      "type": "array"
    },
    "lineage": {
      "$ref": "#/$defs/path"
    },
    "reports": {
      "additionalProperties": false,
      "properties": {
        "determinism": {
          "$ref": "#/$defs/path"
        },
        "publishability": {
          "$ref": "#/$defs/path"
        },
        "quality": {
          "$ref": "#/$defs/path"
        },
        "sbom": {
          "$ref": "#/$defs/path"
        }
      },
      "required": [
        "quality",
        "determinism",
        "publishability",
        "sbom"
      ],
      "type": "object"
    },
    "run_id": {
      "$ref": "#/$defs/run_id"
    },
    "schema_version": {
      "enum": [
        "1.0"
      ],
      "type": "string"
    },
    "warehouse": {
      "$ref": "#/$defs/path"
    }
  },
  "required": [
    "schema_version",
    "run_id",
    "created_at",
    "config",
    "inputs",
    "artifacts",
    "reports",
    "lineage",
    "warehouse",
    "exports"
  ],
  "title": "Run manifest",
  "type": "object"
}
