{
  "artifacts": {
    "control_files": [
      {
        "bytes": 924,
        "path": "logs/run.jsonl",
        "sha256": "e13c47220cdc1278b2b816c1d24b8027ee92bf126a23d6193aed3ddf20a63377"
      },
      {
        "bytes": 1207,
        "path": "reports/determinism_report.json",
        "sha256": "71c787def468a13bc8b38c0044fed28b073b9251b0a42513c6789a2c5444fb14"
      },
      {
        "bytes": 141,
        "path": "reports/publishability_report.json",
        "sha256": "5b76109da8e736b196972dddcca52b5f4ec6d6292fba0e25731d3434d02ffeaf"
      },
      {
        "bytes": 28015,
        "path": "reports/sbom_manifest.json",
        "sha256": "37d1a5567f1bcf8a97ac5174599d8ddf86137c2c6d8ee24169154912b8b89145"
      }
    ],
    "files": [
      {
        "bytes": 268,
        "path": "exports/briefing_tables/briefing_table_entities.csv",
        "sha256": "db0bdd6ac85f6f0ac59929e3994009b24b9df774d77eef8d03b3e221299eec97"
      },
      {
        "bytes": 355,
        "path": "exports/narratives/deltas.md",
        "sha256": "fb5310dedb879dd345871e433059c5fa76ea5c77bdb0ba8b2c47f68f2fc55801"
      },
      {
        "bytes": 1719,
        "path": "exports/packets/packet_E0001.json",
        "sha256": "11181c4cc192314d7c68a3339e565f039724a9ebba9b6cc3b9b68be2b429ba25"
      },
      {
        "bytes": 1719,
        "path": "exports/packets/packet_E0002.json",
        "sha256": "64b30c48c78d7453c1a116f061e14f2584aca0969a9738895d1ae57571a3aa2f"
      },
      {
        "bytes": 1642,
        "path": "exports/packets/packet_E0008.json",
        "sha256": "d9689582559413b392e7f2b35cf89bb72c0190bb2e86c605567b26508f24000e"
      },
      {
        "bytes": 1626,
        "path": "exports/packets/packet_E0015.json",
        "sha256": "43158a4300f1926a1820c5fc84a95979194b59a9bd370e6f116cf2cdc33ae1d7"
      },
      {
        "bytes": 1985,
        "path": "lineage/lineage.jsonl",
        "sha256": "b5b575969c3c3f3437bc8f7980d04b54e9cab5e19927c594a67ea8d5fdc02f55"
      },
      {
        "bytes": 139,
        "path": "reports/quality_report.json",
        "sha256": "5c2fdca8c4631074dbccacc416d0d5d91cd64e11d1ac41e9b5a2206bbddf5ca6"
      },
      {
        "bytes": 45056,
        "path": "warehouse/warehouse.sqlite",
        "sha256": "452b93e8b6663beea916347b7f5e2fd1133e2dd2eb356bbc361f7eca0439e754"
      }
    ],
    "root_hash": "10eb38a88a7842af372d1af6d0edffcad4ff8d3744b48c1a23aaf139afa1dbbd"
  },
  "config": {
    "fingerprint": "7ce26d580cf28a95199ebdb63e73d1972a65ae6d4594f5337bd6043fbeccc431",
    "payload": {
      "inputs": {
        "registry": {
          "entities": 20
        },
        "trade_feed": {
          "records": 60
        }
      },
      "rules": {
        "pack": "smoke",
        "paths": []
      },
      "run": {
        "hermetic": true,
        "run_name": "smoke4",
        "seed": 7
      },
      "schema_version": "1.0"
    },
    "source": {
      "name": "omphalos_smoke4.yaml",
      "sha256": "cb191d157bee87fa5a2d3ce4c69e152b6037b58b72142f29197123aa67372b9a"
    }
  },
  "created_at": "2019-08-24T14:35:54Z",
  "exports": {
    "briefing_tables": [
      "exports/briefing_tables/briefing_table_entities.csv"
    ],
    "narratives": [
      "exports/narratives/deltas.md"
    ],
    "packets": [
      "exports/packets/packet_E0002.json",
      "exports/packets/packet_E0008.json",
      "exports/packets/packet_E0015.json",
      "exports/packets/packet_E0001.json"
    ]
  },
  "inputs": [
    {
      "fingerprint": "a5bcc87b23d5d4ce218914787819f7ee2fe8d67675e4f96d3fff5d01cbc9f571",
      "name": "trade_feed",
      "row_count": 60
    },
    {
      "fingerprint": "5000cec7a57f7ea74d4e99930a2199a50f51259569433c8ba80c34560eb02a4a",
      "name": "registry",
      "row_count": 20
    }
  ],
  "lineage": "lineage/lineage.jsonl",
  "reports": {
    "determinism": "reports/determinism_report.json",
    "publishability": "reports/publishability_report.json",
    "quality": "reports/quality_report.json",
    "sbom": "reports/sbom_manifest.json"
  },
  "run_id": "run-7ce26d58-0cf2",
  "schema_version": "1.0",
  "warehouse": "warehouse/warehouse.sqlite"
}
